<?xml version="1.0" encoding="UTF-8"?>
<biblioteca xmlns:xs="http://www.w3.org/2001/XMLSchema-instance" xs:noNamespaceSchemaLocation="biblioteca.xsd">
  <discos>
    <disco id="1">
      <nombre>Tubular bells 2</nombre>
      <productores>
        <productor codigo="365895" nacionalidad="canadiense">Jennifer McNeal</productor>
        <productor codigo="458958" nacionalidad="británica">Mike Oldfield</productor>
      </productores>
      <editor codigo="596859" nacionalidad="británica">Anthony Baletti</editor>
      <anio>1997</anio>
      <canciones>
        <cancion id="1">
          <titulo>Sentinel</titulo>
          <compositores>
            <compositor codigo="120336" nacionalidad="británica">Mikel Oldfield</compositor>
            <compositor codigo="748554" nacionalidad="estadounidense">Susanne Smith</compositor>
          </compositores>
          <duracion>00:08:06</duracion>
          <interpretes>
            <interprete codigo="121220" nacionalidad="británica">Mike Oldfield 1</interprete>
            <interprete codigo="122220" nacionalidad="británica">Mike Oldfield 2</interprete>
            <interprete codigo="123220" nacionalidad="británica">Mike Oldfield 3</interprete>
          </interpretes>
        </cancion>
        <cancion id="2">
          <titulo>Dark Star</titulo>
          <compositores>
            <compositor codigo="487584" nacionalidad="británica">Mikel Oldfield</compositor>
            <compositor codigo="658998" nacionalidad="británica">Mikel Oldfield</compositor>
            <compositor codigo="325448" nacionalidad="británica">Mikel Oldfield</compositor>
          </compositores>
          <duracion>00:02:16</duracion>
          <interpretes>
            <interprete codigo="956558" nacionalidad="británica">Mike Oldfield</interprete>
          </interpretes>
        </cancion>
        <cancion id="3">
          <titulo>Hello World</titulo>
          <compositores>
            <compositor codigo="145558" nacionalidad="británica">Mikel Oldfield</compositor>
          </compositores>
          <duracion>00:03:28</duracion>
          <interpretes>
            <interprete codigo="120003" nacionalidad="británica">Mike Oldfield</interprete>
          </interpretes>
        </cancion>
      </canciones>
    </disco>
    <disco id="2">
      <nombre>Tubular bells 3</nombre>
      <productores>
        <productor codigo="965885" nacionalidad="canadiense">Jennifer McNeal</productor>
        <productor codigo="120332" nacionalidad="británica">Mike Oldfield</productor>
      </productores>
      <editor codigo="658998" nacionalidad="británica">Anthony Baletti</editor>
      <anio>1999</anio>
      <canciones>
        <cancion id="1">
          <titulo>The Source of Secrets</titulo>
          <compositores>
            <compositor codigo="959889" nacionalidad="británica">Mikel Oldfield</compositor>
            <compositor codigo="102114" nacionalidad="estadounidense">Susanne Smith</compositor>
          </compositores>
          <duracion>00:01:06</duracion>
          <interpretes>
            <interprete codigo="326558" nacionalidad="británica">Mike Oldfield</interprete>
          </interpretes>
        </cancion>
        <cancion id="2">
          <titulo>The Watchful Eye</titulo>
          <compositores>
            <compositor codigo="120114" nacionalidad="británica">Mikel Oldfield</compositor>
          </compositores>
          <duracion>00:09:16</duracion>
          <interpretes>
            <interprete codigo="120225" nacionalidad="británica">Mike Oldfield</interprete>
          </interpretes>
        </cancion>
      </canciones>
    </disco>
    <disco id="3">
      <nombre>Tubular bells 1</nombre>
      <productores>
        <productor codigo="120225" nacionalidad="canadiense">Jennifer McNeal</productor>
        <productor codigo="120114" nacionalidad="británica">Mike Oldfield</productor>
      </productores>
      <editor codigo="252669" nacionalidad="británica">Anthony Baletti</editor>
      <anio>1997</anio>
      <canciones>
        <cancion id="1">
          <titulo>Sentinel</titulo>
          <compositores>
            <compositor codigo="120225" nacionalidad="británica">Mikel Oldfield</compositor>
            <compositor codigo="895558" nacionalidad="estadounidense">Susanne Smith</compositor>
          </compositores>
          <duracion>00:08:06</duracion>
          <interpretes>
            <interprete codigo="120225" nacionalidad="británica">Mike Oldfield</interprete>
          </interpretes>
        </cancion>
        <cancion id="2">
          <titulo>Dark Star</titulo>
          <compositores>
            <compositor codigo="565889" nacionalidad="británica">Mikel Oldfield</compositor>
          </compositores>
          <duracion>00:02:16</duracion>
          <interpretes>
            <interprete codigo="858774" nacionalidad="británica">Mike Oldfield</interprete>
          </interpretes>
        </cancion>
        <cancion id="3">
          <titulo>Hello World</titulo>
          <compositores>
            <compositor codigo="120224" nacionalidad="británica">Mikel Oldfield</compositor>
          </compositores>
          <duracion>00:03:28</duracion>
          <interpretes>
            <interprete codigo="958457" nacionalidad="británica">Mike Oldfield</interprete>
          </interpretes>
        </cancion>
      </canciones>
    </disco>
    <disco id="4">
      <nombre>Tubular bells 4</nombre>
      <productores>
        <productor codigo="958774" nacionalidad="canadiense">Jennifer McNeal</productor>
        <productor codigo="265885" nacionalidad="británica">Mike Oldfield</productor>
      </productores>
      <editor codigo="625369" nacionalidad="británica">Anthony Baletti</editor>
      <anio>1997</anio>
      <canciones>
        <cancion id="1">
          <titulo>Sentinel</titulo>
          <compositores>
            <compositor codigo="958558" nacionalidad="británica">Mikel Oldfield</compositor>
            <compositor codigo="625998" nacionalidad="estadounidense">Susanne Smith</compositor>
          </compositores>
          <duracion>00:08:06</duracion>
          <interpretes>
            <interprete codigo="235665" nacionalidad="británica">Mike Oldfield</interprete>
          </interpretes>
        </cancion>
        <cancion id="2">
          <titulo>Dark Star</titulo>
          <compositores>
            <compositor codigo="125447" nacionalidad="británica">Mikel Oldfield</compositor>
          </compositores>
          <duracion>00:02:16</duracion>
          <interpretes>
            <interprete codigo="859887" nacionalidad="británica">Mike Oldfield</interprete>
          </interpretes>
        </cancion>
        <cancion id="3">
          <titulo>Hello World</titulo>
          <compositores>
            <compositor codigo="125447" nacionalidad="británica">Mikel Oldfield</compositor>
          </compositores>
          <duracion>00:03:28</duracion>
          <interpretes>
            <interprete codigo="154774" nacionalidad="británica">Mike Oldfield</interprete>
          </interpretes>
        </cancion>
      </canciones>
    </disco>
    <disco id="5">
      <nombre>Tubular bells 5</nombre>
      <productores>
        <productor codigo="236558" nacionalidad="Nac1111">Productor1</productor>
        <productor codigo="254774" nacionalidad="Nac2222">Productor2</productor>
        <productor codigo="203021" nacionalidad="Nac3333">Productor3</productor>
      </productores>
      <editor codigo="365885" nacionalidad="canadiense">Anthony Baletti</editor>
      <anio>1995</anio>
      <canciones>
        <cancion id="1">
          <titulo>Cancion 1</titulo>
          <compositores>
            <compositor codigo="985441" nacionalidad="Cancion1Compositor1Nac1">Cancion1Compositor1</compositor>
            <compositor codigo="955847" nacionalidad="Cancion1Compositor2Nac2">Cancion1Compositor2</compositor>
          </compositores>
          <duracion>00:01:11</duracion>
          <interpretes>
            <interprete codigo="325441" nacionalidad="Cancion1Interprete1Nac1">Cancion1Interprete1</interprete>
          </interpretes>
        </cancion>
        <cancion id="2">
          <titulo>Cancion 2</titulo>
          <compositores>
            <compositor codigo="954774" nacionalidad="Cancion2Compositor1Nac1">Cancion2Compositor1</compositor>
          </compositores>
          <duracion>00:02:22</duracion>
          <interpretes>
            <interprete codigo="326585" nacionalidad="Cancion2Interprete1Nac1">Cancion2Interprete1</interprete>
          </interpretes>
        </cancion>
        <cancion id="3">
          <titulo>Cancion 3</titulo>
          <compositores>
            <compositor codigo="625884" nacionalidad="Cancion3Compositor1Nac1">Cancion3Compositor1</compositor>
            <compositor codigo="958774" nacionalidad="Cancion3Compositor2Nac1">Cancion3Compositor2</compositor>
            <compositor codigo="252524" nacionalidad="Cancion3Compositor3Nac1">Cancion3Compositor3</compositor>
          </compositores>
          <duracion>00:03:33</duracion>
          <interpretes>
            <interprete codigo="658995" nacionalidad="Cancion3Interprete1Nac1">Cancion3Interprete1</interprete>
          </interpretes>
        </cancion>
      </canciones>
    </disco>
    <disco id="6">
      <nombre>Nuevo disco de prueba</nombre>
      <productores>
        <productor codigo="989885" nacionalidad="canadiense">Productor</productor>
      </productores>
      <editor codigo="232551" nacionalidad="1">John Smith</editor>
      <anio>2018</anio>
      <canciones>
        <cancion id="1">
          <titulo>Cancion 1</titulo>
          <compositores>
            <compositor codigo="365889" nacionalidad="estadounidense">Compositor 1</compositor>
          </compositores>
          <duracion>00:30:55</duracion>
          <interpretes>
            <interprete codigo="125774" nacionalidad="francés">Interprete 1</interprete>
          </interpretes>
        </cancion>